{
  "$schema": "https://json-schema.org/draft/2020-12/schema",
  "$id": "https://wazir.dev/schemas/implementation-plan.schema.json",
  "title": "Implementation Plan Artifact",
  "type": "object",
  "required": ["phase", "role", "run_id", "created_at", "sources", "status", "loop_number", "sections", "approval"],
  "properties": {
    "phase": { "const": "plan" },
    "role": { "const": "planner" },
    "run_id": { "type": "string", "minLength": 1 },
    "created_at": { "type": "string", "format": "date-time" },
    "sources": { "type": "array", "items": { "type": "string" } },
    "status": { "type": "string", "minLength": 1 },
    "loop_number": { "type": "integer", "minimum": 0 },
    "sections": { "type": "array", "items": { "type": "string" } },
    "approval": { "type": "string", "minLength": 1 }
  },
  "additionalProperties": true
}
